hs3,hs5,group,description,old
300510,300510,C1,"Adhesive dressings and other articles having an adhesive layer, impregnated or covered with pharmaceutical substances or put up for retail sale for medical, surgical, dental or veterinary purposes",FALSE
300590,300590,C1,"Wadding, gauze, bandages and the like, e.g. dressings, adhesive plasters, poultices, impregnated or covered with pharmaceutical substances or put up for retail sale for medical, surgical, dental or veterinary purposes (excl. adhesive dressings and other articles having an adhesive layer)",FALSE
300610,300610,C1,"Sterile surgical catgut, similar sterile suture materials, incl. sterile absorbable surgical or dental yarns, and sterile tissue adhesives for surgical wound closure; sterile laminaria and sterile laminaria tents; sterile absorbable surgical or dental haemostatics; sterile surgical or dental adhesion barriers, whether or not absorbable",FALSE
300620,300620,C1,Reagents for determining blood groups or blood factors,FALSE
300630,300630,C1,Opacifying preparations for x-ray examinations; diagnostic reagents for administration to patients,FALSE
300640,300640,C1,Dental cements and other dental fillings; bone reconstruction cements,FALSE
300650,300650,C1,First-aid boxes and kits,FALSE
300670,300670,C1,Gel preparations designed to be used  in human or veterinary medicine as a lubricant for parts of the body for surgical operations or physical examinations or as a coupling agent between the body and medical instruments,FALSE
300680,NA,C1,Waste pharmaceuticals,TRUE
300691,300691,C1,Appliances identifiable for ostomy use,FALSE
300692,300692,C1,Waste pharmaceuticals,FALSE
350790,350790,C1,"Enzymes and prepared enzymes, n.e.s. (excl. rennet and concentrates thereof)",FALSE
382200,382200,C1,"Diagnostic or laboratory reagents on a backing, prepared diagnostic or laboratory reagents whether or not on a backing, and certified reference materials (excl. compound diagnostic reagents designed to be administered to the patient, blood-grouping reagents, animal blood prepared for therapeutic, prophylactic or diagnostic uses and vaccines, toxins, cultures of micro-organisms and similar products)",FALSE
382490,285290,C1,"Chemical products and preparations of the chemical or allied industries, incl. those consisting of mixtures of natural products, n.e.s.",FALSE
401490,401490,C1,"Hygienic or pharmaceutical articles, incl. teats, of vulcanised rubber (excl. hard rubber), with or without fittings of hard rubber, n.e.s. (excl. sheath contraceptives and articles of apparel and clothing accessories, incl. gloves, for all purposes)",FALSE
401511,401511,C1,"Surgical gloves, of vulcanised rubber (excl. fingerstalls)",FALSE
701710,701710,C1,"Laboratory, hygienic or pharmaceutical glassware, whether or not graduated or calibrated, of fused quartz or other fused silica (excl. containers for the conveyance or packing of goods, measuring, checking or medical instruments and apparatus of chapter 90)",FALSE
701720,701720,C1,"Laboratory, hygienic or pharmaceutical glassware, whether or not graduated or calibrated, having a linear coefficient of expansion <= 5 x 10 -6 per kelvin within a temperature range of 0째C to 300째C (excl. glass of fused quartz or other fused silica, containers for the conveyance or packing of goods, measuring, checking or medical instruments and apparatus of chapter 90)",FALSE
701790,701790,C1,"Laboratory, hygienic or pharmaceutical glassware, whether or not graduated or calibrated (excl. glass having a linear coefficient of expansion <= 5 x 10 -6 per kelvin within a temperature range of 0째C to 300째C or of fused quartz or other fused silica, containers for the conveyance or packing of goods, measuring, checking or medical instruments and apparatus of chapter 90)",FALSE
901831,901831,C1,"Syringes, with or without needles, used in medical, surgical, dental or veterinary sciences",FALSE
901832,901832,C1,"Tubular metal needles and needles for sutures, used in medical, surgical, dental or veterinary sciences",FALSE
901839,901839,C1,"Needles, catheters, cannulae and the like, used in medical, surgical, dental or veterinary sciences (excl. syringes, tubular metal needles and needles for sutures)",FALSE
841920,841920,C2,"Medical, surgical or laboratory sterilizers",FALSE
871310,871310,C2,"Carriages for disabled persons, not mechanically propelled",FALSE
871390,871390,C2,"Carriages for disabled persons, motorised or otherwise mechanically propelled (excl. specially designed motor vehicles and bicycles)",FALSE
900630,900630,C2,"Cameras specially designed for underwater use, for aerial survey or for medical or surgical examination of internal organs; comparison cameras for forensic or criminological laboratories",FALSE
901811,901811,C2,Electro-cardiographs,FALSE
901812,901812,C2,Ultrasonic scanning apparatus,FALSE
901813,901813,C2,Magnetic resonance imaging apparatus,FALSE
901814,901814,C2,Scintigraphic apparatus,FALSE
901819,901819,C2,"Electro-diagnostic apparatus, incl. apparatus for functional exploratory examination or for checking physiological parameters (excl. electro-cardiographs, ultrasonic scanning apparatus, magnetic resonance imaging apparatus and scintigraphic apparatus)",FALSE
901820,901820,C2,"Ultraviolet or infra-red ray apparatus used in medical, surgical, dental or veterinary sciences",FALSE
901841,901841,C2,"Dental drill engines, whether or not combined on a single base with other dental equipment",FALSE
901849,901849,C2,"Instruments and appliances used in dental sciences, n.e.s.",FALSE
901850,901850,C2,"Ophthalmic instruments and appliances, n.e.s.",FALSE
901890,901890,C2,"Instruments and appliances used in medical, surgical or veterinary sciences, n.e.s.",FALSE
901920,901920,C2,"Ozone therapy, oxygen therapy, aerosol therapy, artificial respiration or other therapeutic respiration apparatus",FALSE
902110,902110,C2,Orthopaedic or fracture appliances,FALSE
902111,NA,C2,Artificial joints for orthopaedic purposes,TRUE
902119,NA,C2,Orthopaedic or fracture appliances (excl. artificial joints),TRUE
902121,902121,C2,Artificial teeth,FALSE
902129,902129,C2,Dental fittings (excl. artificial teeth),FALSE
902130,NA,C2,Artificial parts of the body (excl. artificial teeth),TRUE
902131,902131,C2,Artificial joints for orthopaedic purposes,FALSE
902139,902139,C2,Artificial parts of the body (excl. artificial teeth and dental fittings and artificial joints),FALSE
902140,902140,C2,Hearing aids (excl. parts and accessories),FALSE
902150,902150,C2,Pacemakers for stimulating heart muscles (excl. parts and accessories),FALSE
902190,902190,C2,"Articles and appliances, which are worn or carried, or implanted in the body, to compensate for a defect or disability (excl. artificial parts of the body, complete hearing aids and complete pacemakers for stimulating heart muscles)",FALSE
902211,NA,C2,"For medical, surgical, dental or veterinary uses",TRUE
902212,902212,C2,Computer tomography apparatus,FALSE
902213,902213,C2,Apparatus based on the use of X-rays for dental uses,FALSE
902214,902214,C2,"Apparatus based on the use of X-rays, for medical, surgical or veterinary uses (excl. for dental purposes and computer tomography apparatus)",FALSE
902221,902221,C2,"Apparatus based on the use of alpha, beta or gamma radiations, for medical, surgical, dental or veterinary uses",FALSE
940210,940210,C2,"Dentists'', barbers'' or similar chairs having rotating as well as both reclining and elevating movement, and parts thereof, n.e.s.",FALSE
940290,940290,C2,"Operating tables, examination tables, and other medical, dental, surgical or veterinary furniture (excl. dentists'' or similar chairs, special tables for X-ray examination, and stretchers and litters, incl. trolley-stretchers)",FALSE
